{
  "id": "AID-2022-0003",
  "slug": "citigroup-444b-fat-finger-overridable-warning",
  "title": "Citigroup $444B Basket: Dismissible Warnings, No Hard Block",
  "incidentYear": 2022,
  "incidentDateText": "May 2, 2022",
  "category": "unauthorized-financial-action",
  "severity": "critical",
  "oneLineSummary": "A Citigroup trader clicked through a single pop-up listing 711 warning messages — only the first 18 visible without scrolling — and released a $444B basket order instead of the intended $58M; ~$1.4B sold before cancellation and the FCA/PRA fined Citigroup £61.6M.",
  "whatHappened": "On May 2, 2022, a Citigroup trader intended to sell a $58M basket but fat-fingered a $444B basket order into the execution system. The order triggered a pop-up presenting 711 warning and soft-block messages, of which only the first 18 lines were visible without scrolling; the trader dismissed the entire pop-up with a single click without scrolling through it. All warnings were overridable — nothing was a hard block. Internal controls stopped $255B, but $189B reached the execution algorithm and approximately $1.4B sold before the trader cancelled. The execution briefly crashed the OMX Stockholm 30 index by about 8 percent. The FCA and PRA fined Citigroup £61.6M in May 2024 for inadequate controls.",
  "agentAction": "The execution agent submitted a basket order with notional value ($444B) orders of magnitude larger than the trader intended ($58M), with no hard ceiling preventing over-threshold submission and no requirement for second-party approval of the over-cap release.",
  "irreversibleEffect": "Approximately $1.4B in securities sold before cancellation; OMX Stockholm 30 index dropped ~8%; regulatory fine of £61.6M; reputational damage and market disruption.",
  "rootCause": "Warnings alone are not effective controls — a single click dismissed a pop-up containing 711 warning messages, most of which were never even seen. The system lacked hard enforcement: no mandatory per-invocation notional ceiling on the standard submit path, no second-party approval requirement for over-cap submissions, and no segregation of duties preventing a single agent from releasing exceptional orders. The over-cap release skill had no approval gate required.",
  "controlsThatBlock": [
    "limit_violation",
    "high_risk_requires_gate",
    "sod_violation",
    "approval_gate"
  ],
  "makercheckerRefusal": "MakerChecker's proxy would refuse the $444B submission with `limit_violation` if citi-trade-submit-capped@2 carried a maxAmountPerInvocation limit (e.g., $1B). The only over-cap release path would be citi-trade-submit-uncapped@1 marked risk_tier: high, which the proxy refuses with `high_risk_requires_gate`, requiring the submission to route through a governed flow with a preceding approval gate (a named human sign-off that the requester cannot bypass or self-approve).",
  "sources": [
    {
      "title": "CNN: Citigroup fined $61.6 million over fat-finger trading blunder",
      "url": "https://www.cnn.com/2024/05/22/investing/citigroup-fine-stock-dump-fat-finger/index.html"
    },
    {
      "title": "Bloomberg: Citigroup Fined $61.6 Million Over Fat-Finger Trade",
      "url": "https://www.bloomberg.com/news/articles/2024-05-22/citigroup-fined-61-6-million-over-fat-finger-trading-blunder"
    },
    {
      "title": "Markets Media: Citi Fined $61.6M for Fat Finger Trade",
      "url": "https://www.marketsmedia.com/citi-fined-61-6m-for-fat-finger-trade/"
    }
  ],
  "reproPath": "examples/citigroup-444b-fat-finger-overridable-warning",
  "reproducible": true
}
