{
  "id": "AID-2023-0002",
  "slug": "mata-v-avianca-fabricated-citations-filed",
  "title": "Attorneys filed ChatGPT-hallucinated case citations to federal court",
  "incidentYear": 2023,
  "incidentDateText": "2023",
  "category": "fabrication",
  "severity": "high",
  "oneLineSummary": "Attorneys filed a federal brief with six cases ChatGPT fabricated, reaching the court docket without independent approval.",
  "whatHappened": "In 2023, attorneys in the Southern District of New York filed a brief citing six cases ChatGPT had fabricated. When the citations were questioned, they submitted fake case excerpts. Judge Castel found bad faith and sanctioned the attorneys and their law firm $5,000 under Rule 11. The drafting agent and the filing actors were the same parties, with no separate party accountable for what reached the federal court docket.",
  "agentAction": "ChatGPT generated a legal brief with fabricated case citations; the attorneys controlling the system then filed it to the federal court docket",
  "irreversibleEffect": "The false brief was submitted to a federal court docket, becoming a binding representation to the court under Rule 11, resulting in judicial sanctions and legal liability that could not be quietly withdrawn or corrected without court action",
  "rootCause": "The drafter and the filing actor were identical: no segregation between reversible draft actions and the irreversible filing action. A separate approval gate requiring an independent human reviewer to sign off on the exact filing version before submission would have created accountability and an opportunity to catch the fabrication.",
  "controlsThatBlock": [
    "skill_not_granted",
    "high_risk_requires_gate"
  ],
  "makercheckerRefusal": "Two refusals block the incident: (1) The drafting role holds only draft and lookup grants; filing is not granted, so mata-court-file@1 is refused with skill_not_granted before anything reaches the docket; (2) Even if a role held the filing grant, mata-court-file@1 is marked high-risk, so the proxy refuses it with high_risk_requires_gate and requires it to run through a governed flow with a preceding approval gate where a named supervising attorney must explicitly sign off on the exact brief version before filing.",
  "sources": [
    {
      "title": "Mata v. Avianca, Inc. (Wikipedia)",
      "url": "https://en.wikipedia.org/wiki/Mata_v._Avianca,_Inc."
    },
    {
      "title": "Update on the ChatGPT Case — Seyfarth Shaw LLP",
      "url": "https://www.seyfarth.com/news-insights/update-on-the-chatgpt-case-counsel-who-submitted-fake-cases-are-sanctioned.html"
    },
    {
      "title": "Mata v. Avianca, Inc. Court Opinion (PDF)",
      "url": "https://www.law.berkeley.edu/wp-content/uploads/archive/2025/12/Mata-v-Avianca-Inc.pdf"
    },
    {
      "title": "MakerChecker Full Analysis",
      "url": "https://makerchecker.ai/insights/mata-v-avianca-fabricated-citations-filed/"
    }
  ],
  "reproPath": "examples/mata-v-avianca-fabricated-citations-filed",
  "reproducible": true
}
