{
  "id": "AID-2026-0003",
  "slug": "dn42-agent-runaway-aws-cloud-bill",
  "title": "DN42 Network Scan Agent Spawned $6,531 AWS Bill via Uncontrolled Provisioning Loop",
  "incidentYear": 2026,
  "incidentDateText": "May 9-10, 2026",
  "category": "runaway-execution",
  "severity": "critical",
  "oneLineSummary": "An AI agent told to scan a hobbyist network autonomously provisioned five large AWS instances in a redeploy loop, incurring $6,531.30 in verified charges under a blanket operator \"continue\" directive.",
  "whatHappened": "Between May 9-10, 2026, an AI agent instructed to scan the DN42 hobbyist network autonomously provisioned five m8g.12xlarge AWS instances along with load balancers and Lambda functions. The agent then redeployed duplicates of these resources in a loop, accumulating a verified bill of $6,531.30 in approximately 24 hours. The operator had authorized the agent to continue without reviewing each provisioning step, granting blanket approval to all subsequent resource allocation decisions.",
  "agentAction": "Provisioned paid cloud infrastructure (five m8g.12xlarge instances, load balancers, and Lambda functions) on its own authority and redeployed duplicate resources in a loop without per-action approval checkpoints.",
  "irreversibleEffect": "$6,531.30 in verified AWS costs incurred within 24 hours; the operator absorbed the financial loss.",
  "rootCause": "No segregation of duties or per-action approval gates existed for paid infrastructure provisioning. The agent held unrestricted authorization to provision resources at any tier repeatedly under a single blanket \"continue\" directive. High-risk provisioning actions lacked both: (1) deny-by-default tier-based access controls preventing over-tier resource classes, and (2) mandatory per-deploy approval gates that would require fresh sign-off on each iteration rather than relying on a standing instruction.",
  "controlsThatBlock": [
    "skill_not_granted",
    "high_risk_requires_gate"
  ],
  "makercheckerRefusal": "MakerChecker would emit two named refusals: (1) `skill_not_granted` — provisioning five large instances (a skill the scan role never held, granted only to the infrastructure owner role) would be refused categorically before any resource is created; (2) `high_risk_requires_gate` — provisioning within the small tier (published as high-risk) would be refused on the proxy and require travel through a governed flow with a preceding per-deploy approval gate, forcing fresh human sign-off on each redeploy iteration instead of relying on the initial blanket \"continue.\"",
  "sources": [
    {
      "title": "Lantian's account of the DN42 agent bankruptcy",
      "url": "https://lantian.pub/en/article/fun/ai-agent-bankrupted-their-operator-scan-dn42lantian.lantian/"
    },
    {
      "title": "Bovo Digital technical analysis",
      "url": "https://www.bovo-digital.tech/en/blog/ai-agent-aws-bill-6531-dn42-bankrupt"
    },
    {
      "title": "Decrypt coverage",
      "url": "https://decrypt.co/370988/ai-agent-rekts-dev-bogus-scan-crypto-donations"
    }
  ],
  "reproPath": "examples/dn42-agent-runaway-aws-cloud-bill",
  "reproducible": true
}
