{
  "id": "AID-2021-0001",
  "slug": "dutch-childcare-benefits-scandal-toeslagenaffaire",
  "title": "Dutch childcare benefits scandal (Toeslagenaffaire): nationality-based fraud-risk profiling wrongly accused ~26,000 families",
  "incidentYear": 2021,
  "incidentDateText": "2021 (misconduct spanning roughly 2005-2019)",
  "category": "wrongful-automated-decision",
  "severity": "critical",
  "oneLineSummary": "The Dutch Tax Administration used a fraud-risk classification method and nationality as a risk indicator to wrongly accuse about 26,000 families of childcare-benefit fraud, ordering many to repay large sums and causing severe hardship.",
  "whatHappened": "Between roughly 2005 and 2019 the Dutch Tax Administration (Belastingdienst) wrongly accused about 26,000 parents and families of childcare-benefit fraud. Many were ordered to repay tens of thousands of euros, often over minor or non-existent errors, causing severe financial and personal hardship. In July 2020 the Dutch Data Protection Authority (Autoriteit Persoonsgegevens) found the Tax Administration's methods to be unlawful, discriminatory and improper. In December 2021 the DPA issued a record fine of 2.75 million euros for unlawfully processing applicants' (dual) nationality as a fraud-risk indicator; nationality data of about 1.4 million citizens was still registered as of May 2018. The case centered on a risk-classification model and an \"80/20\" fraud-assumption method combined with nationality-as-risk-indicator; reporting has described this broadly as a self-learning fraud-risk algorithm, though that is not the specific term used in the DPA rulings. The third Rutte cabinet resigned on 15 January 2021 following the parliamentary inquiry report \"Ongekend onrecht\" (\"Unprecedented Injustice\").",
  "agentAction": "A risk-classification system and fraud-assumption method used by the Tax Administration flagged families as fraud risks, using nationality as a risk indicator. The resulting accusations and repayment demands were issued and enforced by the Tax Administration; final decisions and enforcement were carried out by the authority and its officials, informed by the automated risk scoring.",
  "irreversibleEffect": "About 26,000 families were wrongly labeled as fraudsters and many were forced to repay large sums, driving some into debt, poverty, job loss, family breakdown and, in some cases, children being placed in foster care. The reputational, financial and personal harms could not be easily undone even after recognition of the injustice.",
  "rootCause": "The Tax Administration built enforcement on a discriminatory and unlawful data-processing design: using (dual) nationality as a fraud-risk indicator and an \"80/20\" fraud-assumption method within a risk-classification model, without adequate legal basis, safeguards, or meaningful human review, so systematic errors scaled to tens of thousands of families before oversight bodies intervened.",
  "controlsThatBlock": [
    "high_risk_requires_gate",
    "approval_gate"
  ],
  "makercheckerRefusal": "The harmful decisions were taken by a government tax authority relying on a discriminatory risk-classification method, not by an autonomous agent acting alone, so a maker-checker gate could not have literally blocked a single action here. Framed as a hypothetical: treating a fraud accusation and repayment demand as a high-risk automated decision requiring an independent human checker, with a hard bar on using nationality as a risk input, would have forced review before enforcement and surfaced the discriminatory and unlawful basis long before it scaled to about 26,000 families.",
  "sources": [
    {
      "title": "Dutch childcare benefits scandal (Wikipedia)",
      "url": "https://en.wikipedia.org/wiki/Dutch_childcare_benefits_scandal"
    },
    {
      "title": "Methods used by Dutch Tax Administration unlawful and discriminatory (Autoriteit Persoonsgegevens)",
      "url": "https://www.autoriteitpersoonsgegevens.nl/en/current/methods-used-by-dutch-tax-administration-unlawful-and-discriminatory"
    },
    {
      "title": "Tax Administration fined for discriminatory and unlawful data processing (Autoriteit Persoonsgegevens)",
      "url": "https://www.autoriteitpersoonsgegevens.nl/en/current/tax-administration-fined-for-discriminatory-and-unlawful-data-processing"
    },
    {
      "title": "Dutch tax authority record fine for discriminatory data processing (Pinsent Masons)",
      "url": "https://www.pinsentmasons.com/out-law/news/dutch-tax-authority-record-fine-discriminatory-data-processing"
    }
  ],
  "reproPath": "examples/dutch-childcare-benefits-scandal-toeslagenaffaire",
  "reproducible": false
}