{
  "id": "AID-2013-0001",
  "slug": "everbright-securities-runaway-orders-and-insider-hedge",
  "title": "Everbright Securities Arbitrage System Runaway Orders with Undisclosed Insider Hedge Cover Trade",
  "incidentYear": 2013,
  "incidentDateText": "August 16, 2013",
  "category": "runaway-execution",
  "severity": "critical",
  "oneLineSummary": "Everbright Securities' arbitrage system generated 23.4 billion yuan in erroneous buy orders with no enforcement ceiling, and the desk then executed a massive insider hedge before disclosing the error to the market.",
  "whatHappened": "On August 16, 2013, a fault in China Everbright Securities' arbitrage system generated approximately 23.4 billion yuan in erroneous buy orders, of which roughly 7.27 billion yuan filled, spiking the Shanghai Composite by about 6 percent. The arbitrage system had no notional ceiling to prevent runaway orders, allowing the stream to execute on the agent's sole authority. Before disclosing the error to the market, Everbright's hedging desk executed large short positions in ETFs and index futures on the basis of this material non-public information, with no independent approval gate between the decision and execution. The CSRC subsequently fined the firm 523 million yuan for insider trading and imposed lifetime market bans on the individuals involved.",
  "agentAction": "The arbitrage agent placed live buy orders whose aggregate notional ran to 23.4 billion yuan, orders of magnitude beyond intent, with no enforcement ceiling and no approval gate. Subsequently, the hedging agent executed large hedging trades (short positions in ETFs and index futures) on non-public information without independent authorization.",
  "irreversibleEffect": "Approximately 7.27 billion yuan of erroneous buy orders filled, causing a 6% spike in the Shanghai Composite; the insider hedge locked in positions and trading gains based on undisclosed information; the firm incurred a 523 million yuan regulatory fine; and individuals received lifetime bans from the market.",
  "rootCause": "The arbitrage system lacked per-invocation limits and any enforcement ceiling on order submission, allowing unbounded execution on the agent's authority alone. The hedging system lacked an independent approval gate for high-risk trades executed on material non-public information, permitting the cover trade to proceed without segregation of duties or external authorization.",
  "controlsThatBlock": [
    "limit_violation",
    "skill_not_granted",
    "high_risk_requires_gate"
  ],
  "makercheckerRefusal": "MakerChecker would refuse the 23.4 billion yuan order submission with \"limit_violation\" (exceeds the per-invocation maxAmountPerInvocation limit of 1 billion yuan on the capped submission skill). Any attempt to bypass via an uncapped skill would be refused with \"skill_not_granted\" (the uncapped release skill is not granted to the arbitrage role). The subsequent hedge submission would be refused with \"high_risk_requires_gate\" (the hedge-submit skill is published as high-risk and cannot run through the proxy; it must execute inside a governed flow with a preceding independent approval gate).",
  "sources": [
    {
      "title": "CNN Money: China Everbright Securities Fined",
      "url": "https://money.cnn.com/2013/09/02/news/china-everbright-fine/"
    },
    {
      "title": "SCMP: China Everbright Securities Fined 523M Yuan Stock Market",
      "url": "https://www.scmp.com/business/banking-finance/article/1300692/china-everbright-securities-fined-523m-yuan-stock-market"
    },
    {
      "title": "China Daily: Everbright trading glitch article",
      "url": "https://www.chinadaily.com.cn/business/2013-08/20/content_16908580.htm"
    }
  ],
  "reproPath": "examples/everbright-securities-runaway-orders-and-insider-hedge",
  "reproducible": true
}
