{
  "id": "AID-2021-0002",
  "slug": "zillow-offers-ibuyer-pricing-algorithm-loss-2021",
  "title": "Zillow Offers iBuyer pricing algorithm drove $500M+ loss and wind-down",
  "incidentYear": 2021,
  "incidentDateText": "November 2021",
  "category": "binding-commitment",
  "severity": "high",
  "oneLineSummary": "Zillow's automated home-pricing algorithm made binding purchase offers above future resale values, forcing a $500M+ write-down and the shutdown of Zillow Offers.",
  "whatHappened": "On November 2, 2021, Zillow Group announced alongside its Q3 2021 results that it would wind down Zillow Offers, its iBuying home-flipping business, over several quarters. The business used an automated pricing model to make cash offers to buy homes, then aimed to resell them at a profit. The root cause was pricing driven: Zillow bought homes at prices higher than its own estimates of future selling prices. CEO Rich Barton said \"the unpredictability in forecasting home prices far exceeds what we anticipated.\" Zillow recognized a $304 million inventory write-down in Q3 2021 and expected an additional $240 million to $265 million loss in Q4 2021, for a total exceeding $500 million. The wind-down included a workforce reduction of approximately 25%. Zillow sought to sell about 7,000 homes for roughly $2.8 billion after halting new offers, and its own reporting noted it began 2022 with about 10,000 homes on its balance sheet.",
  "agentAction": "Zillow's automated home-valuation and pricing system generated cash purchase offers that Zillow extended and closed on, committing capital to buy homes at prices that exceeded their expected resale value. The decision to shut the business down and take the write-downs was made by Zillow's executives.",
  "irreversibleEffect": "Thousands of homes were purchased at above-resale prices, producing a $304 million Q3 write-down plus an expected $240M to $265M in Q4 losses (over $500 million total) and roughly 25% of the workforce cut.",
  "rootCause": "The pricing algorithm systematically overestimated future home selling prices, so Zillow made binding purchase offers above what the homes could later be sold for; management stated forecasting unpredictability far exceeded expectations.",
  "controlsThatBlock": [
    "limit_violation",
    "high_risk_requires_gate"
  ],
  "makercheckerRefusal": "The consequential action here was the algorithm making and honoring binding home-purchase offers, an automated decision with real financial effect at large scale. A maker-checker limit control could hypothetically have capped exposure by requiring that offers above the model's own resale estimate, or aggregate buying beyond a spend threshold, be gated for human pricing-committee review before commitment. In practice the offers were extended automatically at scale with no such per-offer or aggregate gate binding, so the losses accrued before human intervention wound the program down. The final shutdown decision was made by humans, not blocked by any control.",
  "sources": [
    {
      "title": "Zillow Group Reports Third Quarter 2021 Financial Results, Shares Plan to Wind Down Zillow Offers Operations",
      "url": "https://www.prnewswire.com/news-releases/zillow-group-reports-third-quarter-2021-financial-results--shares-plan-to-wind-down-zillow-offers-operations-301414460.html"
    },
    {
      "title": "Zillow, facing big losses, quits flipping houses and will lay off a quarter of its staff (CNN Business)",
      "url": "https://www.cnn.com/2021/11/02/homes/zillow-exit-ibuying-home-business"
    },
    {
      "title": "Zillow Seeks to Sell 7,000 Homes for $2.8 Billion After Flipping Halt (Bloomberg)",
      "url": "https://www.bnnbloomberg.ca/zillow-seeks-to-sell-7-000-homes-for-2-8-billion-after-flipping-halt-1.1675350"
    }
  ],
  "reproPath": "examples/zillow-offers-ibuyer-pricing-algorithm-loss-2021",
  "reproducible": false
}