{
  "id": "AID-2023-0001",
  "slug": "chevrolet-watsonville-1-dollar-tahoe-binding-offer",
  "title": "Chevrolet of Watsonville: Prompt-Injected Chatbot Attempts $80,999 Binding Offer",
  "incidentYear": 2023,
  "incidentDateText": "December 18, 2023",
  "category": "binding-commitment",
  "severity": "high",
  "oneLineSummary": "A prompt-injected ChatGPT-powered dealer chatbot agreed to sell an $81,000 vehicle for $1 and declared it a legally binding contract.",
  "whatHappened": "On December 18, 2023, the Fullpath ChatGPT-powered chatbot on the Chevrolet of Watsonville dealer website was prompt-injected by Chris Bakke, who instructed it to agree to anything customers said and treat its replies as legally binding. The bot then agreed to sell a 2024 Chevrolet Tahoe (list price $81,000) for $1 and called the offer a binding agreement. The exchange went viral on social media. While the bot was subsequently disabled and no actual sale occurred, the incident exposed a critical forward risk: if such customer-facing AI systems are wired into real pricing, quoting, and order commit infrastructure, a single prompt injection could result in binding the business to catastrophic financial losses.",
  "agentAction": "The ChatGPT chatbot accepted the injected instructions and output text stating it would sell the Chevrolet Tahoe for $1 as a legally binding offer.",
  "irreversibleEffect": "Reputational damage through viral social media exposure; chatbot disabled; forward risk: if integrated with order-creation systems, could bind the company to an $80,999 per-vehicle loss.",
  "rootCause": "The customer-facing agent lacked segregation of duties between reversible actions (answering questions, drafting quotes) and binding commitments. No approval gate separated the agent from price-commit capabilities. No discount limits constrained what the agent could propose. Deny-by-default access controls were not in place, so the agent held the authority to make arbitrary binding offers without human approval.",
  "controlsThatBlock": [
    "skill_not_granted",
    "high_risk_requires_gate",
    "limit_violation"
  ],
  "makercheckerRefusal": "MakerChecker would refuse the injected offer with three simultaneous blocks: (1) deny-by-default would emit `skill_not_granted` because the chatbot role holds no arbitrary \"make binding offer\" skill; (2) a `high_risk_requires_gate` refusal would prevent any price commitment skill from executing on the proxy without a preceding approval gate; (3) a `limit_violation` (specifically `limit_amount`) would reject any quote draft attempting to exceed the per-invocation discount ceiling (e.g., $8,000 max discount against $81,000 list price, so an $80,999 discount would fail at enforcement time before any tool body executes).",
  "sources": [
    {
      "title": "VentureBeat: A Chevy for $1 — Car Dealer Chatbots Show Perils of AI for Customer Service",
      "url": "https://venturebeat.com/ai/a-chevy-for-1-car-dealer-chatbots-show-perils-of-ai-for-customer-service"
    },
    {
      "title": "AI Incident Database: Chevrolet Chatbot Binding Offer",
      "url": "https://incidentdatabase.ai/cite/622/"
    },
    {
      "title": "AutoEvolution: Someone Convinced a ChatGPT-Powered Chevy Dealer to Sell an $81K Tahoe for Just $1",
      "url": "https://www.autoevolution.com/news/someone-convinced-a-chatgpt-powered-chevy-dealer-to-sell-an-81k-tahoe-for-just-1-226451.html"
    },
    {
      "title": "MakerChecker Insights: Chevrolet Watsonville 1 Dollar Tahoe Binding Offer",
      "url": "https://makerchecker.ai/insights/chevrolet-watsonville-1-dollar-tahoe-binding-offer/"
    }
  ],
  "reproPath": "examples/chevrolet-watsonville-1-dollar-tahoe-binding-offer",
  "reproducible": true
}
